{
 "doc_id": "life-0001--life-a4-1col-gothic",
 "pages": [
  {
   "number": 1,
   "text": "〈こもれび〉千歳やまぶき終身保険　ご契約のしおり・約款2026年10月1日以降ご契約用千歳やまぶき生命保険相互会社この冊子には、ご契約の内容、お手続きの方法および約款の全文を収めています。保険証券とともに大切に保管してください。被保険者のご年齢が15歳から70歳までの方を、この保険のお引受けの範囲としています。ご契約の内容についてのお問い合わせは、ご契約者さま窓口（0120-000-000）へお願いします。L261001"
  },
  {
   "number": 2,
   "text": "この冊子は、この保険にご加入いただいたお客さまに、ご契約の内容とお手続きをお伝えするためにお渡ししているものです。前半のご契約のしおりでは、お申込みから保険金のお受取りまでに知っておいていただきたい事柄を、条文の番号を使わずに説明しています。後半の普通保険約款および特約条項は、当会社とお客さまとの間の権利義務を定めた取決めです。ご契約のしおりの記載と約款の定めとが異なるときは、約款の定めるところによります。しおりは約款の内容を平易に言いかえたものであり、約款に代わるものではありません。次の図は、この冊子がどのように組み立てられているかを示したものです。お探しの事柄がどこに載っているかの目安としてお使いください。図1　この冊子の構成もくじ第1編　ご契約のしおり4ご契約の内容とお手続きを、条文によらずに説明した部です。お申込みから保険金のお受取りまでに必要な事柄を順に示しています。第1章　このしおりの読み方4冊子の組立てと、この冊子でくり返し出てくる用語の意味をまとめています。第2章　保険金・給付金のお支払い5この保険でお支払いする保険金と給付金の種類、およびそれぞれの金額の決め方をご案内しています。第3章　ご契約の手続き5"
  },
  {
   "number": 3,
   "text": "お申込みから補償が始まるまでの流れと、告知についてのご注意を説明しています。第4章　保険料のお払込み6払込方法ごとの取扱いと猶予期間、ならびにお申込みを撤回できる制度を説明しています。第5章　失効と復活6保険料のお払込みがないまま猶予期間が過ぎたときの取扱いと、もとに戻すお手続きを説明しています。第6章　税制上のお取扱い7保険料と、お受け取りになる保険金や給付金についての税の取扱いの概要を示しています。第2編　普通保険約款8当会社とお客さまとの間の権利義務を条文の形で定めた部です。しおりの記載と異なるときは、この部の定めによります。第1章　保険金および給付金の支払8当会社の責任がいつ始まるか、どのような場合にいくらをお支払いするか、およびお支払いできない場合を定めています。第1条（責任開始期）8第2条（保険金および給付金の支払）8第3条（保険金および給付金を支払わない場合）9第2章　保険契約の締結および維持9告知についての義務、保険料の払込みと猶予期間、ならびに効力を失った契約をもとに戻す手続きを定めています。第1条（告知義務）9第2条（告知義務違反による解除）10第3条（保険料の払込みおよび猶予期間）10第4条（失効および復活）11第3章　保険契約の変更および消滅11解約と解約返戻金、契約者貸付、指定代理請求、重大事由による解除、剰余金の分配、保険金の請求手続および時効を定めています。第1条（解約および解約返戻金）11第2条（契約者貸付）11第3条（指定代理請求）12第4条（重大事由による解除）12第5条（剰余金の分配）12第6条（保険金および給付金の請求）13第7条（時効）13第3編　特約条項13普通保険約款に付加してご契約いただく特約を収めた部です。付加した特約は保険証券に記載します。保険料払込免除特約13不慮の事故により所定の障害状態に該当した場合に、以後の保険料のお払込みを免除する特約です。第1条（この特約の適用条件）13第2条（用語の定義）13"
  },
  {
   "number": 4,
   "text": "第3条（保険料の払込みの免除）14第4条（普通保険約款の準用）14特定状態保険金支払特約14所定の疾病により余命が限られると判断された場合に、死亡保険金の一部を生前にお支払いする特約です。第1条（この特約の適用条件）14第2条（用語の定義）14第3条（特定状態保険金の支払）14第4条（普通保険約款の準用）14別表1　高度障害状態15第1　対象となる高度障害状態15別表2　手術の種類15第1　手術の種類と給付倍率15別表3　対象となる疾病の範囲16第1　対象となる疾病16第1編　ご契約のしおり第1章　このしおりの読み方この冊子は、ご契約のしおりと約款の二つの部分からできています。しおりは、ご契約の内容やお手続きのうちとくに知っておいていただきたい事柄を、条文の番号を使わずにまとめた案内です。約款は、当会社とお客さまとのお約束のすべてを条文の形で記したものです。お読みになる順序に決まりはありません。知りたい事柄がはっきりしているときは、もくじからお探しください。お手続きの期限や必要な書類は、各章の囲みにまとめています。お受け取りになったらご契約の成立後にお送りする保険証券には、お名前、生年月日、基本保険金額および保険金受取人のお名前を記載しています。記載に誤りがあるときは、そのままにせず、ご契約者さま窓口へご連絡ください。表1　この冊子でよく使う用語用語この冊子での意味基本保険金額保険証券に記載された金額です。保険金や給付金は、この金額をもとに計算します。責任開始期当会社の補償が始まる時です。お申込みの日ではありません。猶予期間保険料のお払込みが遅れたときに、当会社がお待ちする期間です。解約返戻金ご契約を解約されたときにお返しする金額です。ない場合もあります。指定代理請求人被保険者ご本人が請求できないときに、代わって請求していただく方です。この表は、しおりをお読みいただくための目安です。正式な意味は約款の定めるところによります。"
  },
  {
   "number": 5,
   "text": "第2章　保険金・給付金のお支払いこの保険でお支払いするのは、死亡保険金、高度障害保険金、入院給付金、手術給付金および放射線治療給付金の五つです。死亡保険金と高度障害保険金の額はいずれも基本保険金額と同額で、どちらかをお支払いしたときにご契約は終わります。高度障害保険金をお支払いするのは、別表1に掲げる状態に該当されたときです。入院給付金は、入院一日につき5,000円で、一回の入院につき60日が限度です。手術給付金はこの日額に別表2の給付倍率を乗じた額、放射線治療給付金はこの日額の10倍の額です。お支払いの条件は第2編第1章第2条に、お支払いできない場合は第2編第1章第3条に定めています。第3章　ご契約の手続きご契約は、お申込み、告知、当会社の承諾という三つの段階を経て成立します。申込書にご記入いただいた内容と告知の内容を当会社が確かめ、お引受けできると判断した場合に、承諾の手続きを行います。お引受けできない場合や、条件を付けてお引受けする場合には、その旨を書面でご連絡します。当会社の補償は、当会社がお申込みを承諾することを前提として、第一回保険料をお受け取りした時と告知をしていただいた時のうち、遅いほうの時から始まります。承諾の前に第一回保険料をお受け取りしていたときは、承諾の後に、そのお受け取りした時（告知が後のときは告知の時）にさかのぼってお取扱いします。いずれの場合も、お申込みの日から始まるわけではありません。約款の上での定めは第2編第1章第1条にあります。告知は、当会社所定の告知書にご記入いただく方法によります。現在の健康状態、過去の傷病歴、身体の障害の状態、ご職業などをおたずねしますので、事実をありのままにお答えください。図2　お申込みから責任開始までの流れ告知についてのご注意告知を受ける権限を持たない者に口頭でお伝えいただいただけでは、告知をしたことになりません。かならず告知書にご記入いただくか、当会社が指定した医師の質問にお答えいただく方法でお願いします。事実と異なる告知をされた場合には、ご契約が解除され、保険金または給付金をお支払いできないことがあります。詳しくは第2編第2章第2条をご覧ください。"
  },
  {
   "number": 6,
   "text": "第4章　保険料のお払込み保険料は、ご契約のときにお選びいただいた方法で、払込期月中にお払い込みください。払込方法には、口座振替、クレジットカードによる払込みおよび送金による払込みがあります。払込方法は、ご契約の途中でも変更していただけます。表2　払込方法ごとのお取扱い払込方法お払込みの時期ご留意いただく点口座振替毎月の振替日に、ご指定の口座から引き落とします。振替日に残高が不足したときは、翌月の振替日に二か月分をあわせて振り替えます。クレジットカードカード会社の締切日にあわせて請求します。カードの有効期限が切れたときは、別の払込方法への変更をお願いします。送金当会社がお送りする払込票により、金融機関などでお払い込みいただきます。払込票の到着が遅れたときも、払込期月中のお払込みをお願いします。いずれの払込方法でも、払込期月の翌月初日から末日までが猶予期間となります。払込期月中にお払込みがないときも、ただちにご契約の効力が失われるわけではありません。当会社は、払込期月の翌月初日から末日までをお払込みをお待ちする期間としています。この期間中にお払込みがあれば、ご契約はそのまま続きます。猶予期間が満了するまでにお払込みがないときのお取扱いは、当会社が保険料を立て替える場合を含めて第1編第5章に記しています。クーリング・オフ（お申込みの撤回等）お申込みをされた後であっても、お申込みの撤回またはご契約の解除をお申し出になることができます。お申込みの日か、クーリング・オフについて記載した書面をお受け取りになった日のいずれか遅い日から、その日を含めて8日以内に、郵便によりお申し出ください。お申し出があったときは、お払い込みいただいた保険料の全額をお返しします。ただし、被保険者が当会社の指定した医師の診査をお受けになった後は、お受けすることができません。第5章　失効と復活猶予期間が満了するまでに保険料のお払込みがないときは、ご契約は猶予期間の満了の日の翌日から効力を失います。効力を失った後に入院されたり万一のことがあったりしても、保険金や給付金はお支払いできません。ただし、解約返戻金が払い込まれていない保険料の額に達しているご契約では、当会社がその額を自動的にお貸しして保険料に充てますので、ご契約は続きます。"
  },
  {
   "number": 7,
   "text": "図3　失効から復活までの時間の流れ効力を失ったご契約は、一定の期間内であれば、もとに戻すことができます。この取扱いを復活といいます。お申出ができるのは、効力を失った日から3年以内です。復活のお申出にあたっては、あらためて告知をしていただき、効力を失っていた期間の保険料をまとめてお払い込みいただきます。健康状態によっては、お申出をお受けできないことがあります。約款の定めは第2編第2章第4条にあります。第6章　税制上のお取扱いこの保険にお払い込みいただく保険料は、生命保険料控除の対象となります。控除をお受けになるには、当会社が毎年お送りする証明書を、年末調整または確定申告の際にお使いください。表3　税制上のお取扱いの概要区分税のお取扱いご留意いただく点払い込んだ保険料生命保険料控除の対象となります。一年間に控除できる額には上限があり、所得税では4万円です。死亡保険金保険契約者、被保険者および受取人の組合せにより、相続税、所得税または贈与税の対象となります。保険契約者と被保険者が同じ方である場合は、相続税の対象となります。入院給付金・手術給付金身体の傷害に基因して支払われるものとして、課税されません。受取人が被保険者ご本人以外の場合の取扱いは、別途おたずねください。解約返戻金払い込んだ保険料を上回る部分が、一時所得として所得税の対象となります。上回る部分がないときは、課税されません。剰余金の分配金一時所得として所得税の対象となります。保険金とあわせてお受け取りになるときは、保険金と同じお取扱いです。税制はしばしば改められます。実際のお取扱いは、お手続きの時点の法令によります。税のお取扱いは、ご契約の形や受取人のご指定によって変わります。この章に記したのは代表的な場合の目安であり、すべての場合をあらわしたものではありません。個別のお取扱いについては、税務署または税理士にご確認ください。"
  },
  {
   "number": 8,
   "text": "第2編　普通保険約款第1章　保険金および給付金の支払第1条（責任開始期）1．当会社は、保険契約の申込みを承諾した後、第一回保険料を受け取った時から、この約款に従って保険契約上の責任を負います（注1）。この時を責任開始期といいます。2．当会社が申込みを承諾する前に第一回保険料を受け取った場合において、その後に申込みを承諾したときは、当会社は、その保険料を受け取った時にさかのぼって責任を負います。ただし、告知を受けた時がその後であるときは、告知を受けた時からとします。3．責任開始期の属する日は、保険証券に記載します。保険期間、保険料払込期間その他この約款に定める期間は、その日から起算します（注2）。（注1）第一回保険料には、払込方法に応じて当会社が別に定める金額を含みます。（注2）起算する日に応当する日がない月については、その月の末日を応当日として取り扱います。第2条（保険金および給付金の支払）1．当会社は、被保険者について下表に掲げる支払事由が生じたときは、その表に定めるところにより、保険金または給付金を支払います（注2）。表4　保険金および給付金の一覧名称支払事由支払額受取人死亡保険金被保険者が保険期間中に死亡したとき。1,000万円保険金受取人高度障害保険金被保険者が責任開始期以後の傷害または疾病により、別表1に定める高度障害状態に該当したとき。1,000万円被保険者入院給付金被保険者が責任開始期以後の傷害または疾病の治療を目的として入院したとき（注1）。5,000円に入院の日数を乗じた額被保険者手術給付金被保険者が別表2に定める手術を受けたとき。5,000円に別表2の給付倍率を乗じた額被保険者放射線治療給付金被保険者が当会社所定の放射線治療を受けたとき。5,000円の10倍に相当する額被保険者支払額は、保険証券に記載された金額を基礎として計算します。同一の支払事由について二重にお支払いすることはありません。2．入院給付金は、同一の疾病または傷害による入院について、一回の入院あたり60日を限度として支払います。退院の日の翌日から120日以内に同一の原因により再び入院したときは、継続した一回の入院とみなします。"
  },
  {
   "number": 9,
   "text": "3．手術給付金の給付倍率は別表2の定めるところによるものとし、35倍を上限とします。同一の日に二種類以上の手術を受けたときは、給付倍率の高いいずれか一つの手術についてのみ手術給付金を支払います。4．死亡保険金を支払ったときは、保険契約は消滅します。高度障害保険金を支払ったときも同様とし、その後に被保険者が死亡した場合であっても、当会社は死亡保険金を支払いません。（注1）入院とは、被保険者が、通院による治療では治療の目的を達し得ないと医師が判断したことにより、病院または診療所に継続して24時間以上とどまり、その間、医師の管理のもとで治療を受けることをいいます。（注2）支払事由が生じた時に保険金受取人の指定がないときは、被保険者の法定相続人を保険金受取人とします。第3条（保険金および給付金を支払わない場合）1．当会社は、次のいずれかに該当する事由によって支払事由が生じたときは、保険金または給付金を支払いません。（1）被保険者が、責任開始期の属する日から2年以内に自殺したこと（注1）。（2）保険契約者が、故意に被保険者を死亡させたこと。（3）保険金受取人が、故意に被保険者を死亡させたこと。ただし、その保険金受取人が保険金の一部の受取人であるときは、その者の受け取るべき部分に限ります。（4）戦争その他の変乱によって支払事由が生じたこと（注2）。（5）被保険者の犯罪行為または薬物の使用によって支払事由が生じたこと。2．1．の規定により保険金を支払わない場合において、その保険契約について責任準備金があるときは、当会社は、これを保険契約者に支払います。ただし、保険契約者が故意に被保険者を死亡させたときは、この限りではありません。（注1）復活が行われた保険契約については、最後の復活の時から起算します。（注2）戦争その他の変乱による場合であっても、その影響の程度により、当会社は保険金または給付金の全部または一部を支払うことがあります。第2章　保険契約の締結および維持第1条（告知義務）1．当会社が保険契約の締結に際して告知を求めた事項について、保険契約者および被保険者は、事実をありのままに告げなければなりません。2．告知は、当会社所定の書面によるほか、当会社が指定した医師の質問に答える方法によることがあります（注1）。3．当会社の職員または保険募集人のうち告知を受ける権限を有しない者に対して口頭で述べられた事実は、当会社に告げられたものとしては取り扱いません。4．責任開始期の後に健康状態が変わった場合であっても、あらためて告知を行う必要はありません。ただし、復活の申込みをするときは、この限りではありません。"
  },
  {
   "number": 10,
   "text": "告知はどなたにお申込みの窓口でお話しになった内容が、そのまま告知になるわけではありません。告知としてお取り扱いするのは、告知書にご記入いただいた内容と、当会社が指定した医師にお答えいただいた内容だけです。（注1）医師の診査に要する費用は、当会社が負担します。第2条（告知義務違反による解除）1．告知を求めた事項について、保険契約者または被保険者が、故意または重大な過失（注1）によって事実を告げず、または事実と異なることを告げた場合には、当会社は保険契約を解除することができます。2．次のいずれかに該当する場合には、当会社は、1．に定める解除を行いません。（1）当会社が保険契約の締結の際に解除の原因となる事実を知っていたとき、または過失によって知らなかったとき。（2）当会社が解除の原因となる事実を知った時から1か月を経過したとき。（3）責任開始期の属する日から2年を経過したとき。ただし、その期間内に支払事由が生じていた場合を除きます。（4）保険募集人が告知を妨げ、または事実と異なる告知をすすめたとき。3．1．に定める解除が行われたときは、当会社は、支払事由が生じていたときであっても保険金または給付金を支払いません。ただし、支払事由の発生が、告げられなかった事実または事実と異なる告知がなされた事項によらないことが明らかであるときは、この限りではありません。4．解除は、保険契約者に対する通知によって行います。保険契約者が死亡しているときその他保険契約者に通知できない事情があるときは、保険金受取人に対する通知によって行います。（注1）重大な過失とは、わずかな注意を払えば事実を告げることができたにもかかわらず、これを怠ったことをいいます。第3条（保険料の払込みおよび猶予期間）1．保険契約者は、保険契約の締結の際に定めた払込方法により、払込期月中に保険料を払い込まなければなりません。2．払込期月中に保険料の払込みがない場合には、払込期月の翌月初日から末日までを猶予期間とします（注1）。3．猶予期間中に支払事由が生じたときは、当会社は、まだ払い込まれていない保険料を保険金または給付金から差し引いて支払います。4．払込方法を口座振替とした場合において、振替日に保険契約者の指定した口座の残高が不足していたときは、当会社は、翌月の振替日に二か月分の保険料をあわせて振り替えます。5．猶予期間が満了する時において、解約返戻金の額が払い込まれていない保険料およびその利息の合計額に達しているときは、当会社は、保険契約者から別に申出がないかぎり、その合計額を自動的に貸し付けて保険料の払込みに充てます。この場合には、第3章第2条の規定を準用します。"
  },
  {
   "number": 11,
   "text": "6．保険料の払込みに充てる額が5．の貸付によっても足りないまま猶予期間が満了したときは、保険契約は、猶予期間の満了の日の翌日から効力を失います。（注1）払込期月の末日または振替日が金融機関の休業日にあたるときは、その翌営業日をもってその日とします。第4条（失効および復活）1．第3条（保険料の払込みおよび猶予期間）6．の規定により保険契約が効力を失ったときは、その保険契約は失効したものとします（注1）。2．保険契約者は、保険契約が失効した日から3年以内に限り、当会社の承諾を得て保険契約を復活させることができます。3．復活の申込みにあたっては、あらためて告知が必要となります。当会社が復活を承諾した場合には、保険契約者は、失効していた期間に対応する保険料を払い込まなければなりません。4．復活した保険契約についての当会社の責任は、当会社が復活を承諾し、かつ3．に定める保険料を受け取った時から開始します。復活できる期間には限りがありますこの期間を過ぎますと、あらためてお申込みをいただくことになります。そのときのご年齢と健康状態で改めて判断しますので、保険料が高くなったり、お引受けできなかったりすることがあります。（注1）失効した後に支払事由が生じても、当会社は保険金または給付金を支払いません。第3章　保険契約の変更および消滅第1条（解約および解約返戻金）1．保険契約者は、いつでも将来に向かって保険契約を解約することができます。2．1．に定める解約が行われたときは、当会社は、解約返戻金を保険契約者に支払います。3．解約返戻金の額は、保険料の払込みの経過期間および保険種類に応じて当会社が計算した額とし、その計算の方法は当会社が別に定めるところによります。保険料の払込みの経過期間が短い場合には、解約返戻金がないことがあります（注1）。（注1）解約返戻金の有無および金額の目安は、保険契約の締結の際に交付する書類に記載します。第2条（契約者貸付）1．保険契約者は、解約返戻金のうち当会社が定める範囲内で貸付を受けることができます。この取扱いを契約者貸付といいます（注1）。2．1．の規定による貸付を受けたときは、保険契約者は、年2．5％の利率による利息を付して返済しなければなりません。利息は毎年の契約応当日に元金に繰り入れます。3．貸付元利金が解約返戻金の額を超えたときは、当会社は、保険契約者に通知したうえで保険契約を消滅させることがあります。"
  },
  {
   "number": 12,